mysql> select salary from employee_payroll where name = 'Bill';
+------------+
| salary     |
+------------+
| 1000000.88 |
+------------+
1 row in set (0.00 sec)

mysql> select * from employee_payroll
    -> where start between cast('2018-01-03' as date)
    -> and date(now());
+----+---------+------------+------------+
| id | name    | salary     | start      |
+----+---------+------------+------------+
|  1 | Bill    | 1000000.88 | 2018-01-03 |
|  2 | Terisa  | 2000000.88 | 2019-05-13 |
|  3 | Charlie | 6000000.88 | 2020-11-21 |
+----+---------+------------+------------+
3 rows in set (0.00 sec)

mysql> show databases;
+--------------------+
| Database           |
+--------------------+
| cricket            |
| empdb              |
| football           |
| information_schema |
| mysql              |
| payroll_service    |
| performance_schema |
| sys                |
+--------------------+
8 rows in set (0.00 sec)

mysql> use payroll_service;
Database changed
mysql> alter table employee_payroll add gender char(1) after name;
Query OK, 0 rows affected (0.02 sec)
Records: 0  Duplicates: 0  Warnings: 0

mysql> decs employe_payroll;
mysql> desc employee_payroll;
+--------+--------------+------+-----+---------+----------------+
| Field  | Type         | Null | Key | Default | Extra          |
+--------+--------------+------+-----+---------+----------------+
| id     | int unsigned | NO   | PRI | NULL    | auto_increment |
| name   | varchar(150) | NO   |     | NULL    |                |
| gender | char(1)      | YES  |     | NULL    |                |
| salary | double       | NO   |     | NULL    |                |
| start  | date         | NO   |     | NULL    |                |
+--------+--------------+------+-----+---------+----------------+
5 rows in set (0.00 sec)

mysql> update employee_payroll set gender = 'M' where name = 'Bill';
Query OK, 1 row affected (0.01 sec)
Rows matched: 1  Changed: 1  Warnings: 0

mysql> update employee_payroll set gender = 'M' where name = 'Terisa';
Query OK, 1 row affected (0.00 sec)
Rows matched: 1  Changed: 1  Warnings: 0

mysql> update employee_payroll set gender = 'M' where name = 'Charlie';
Query OK, 1 row affected (0.00 sec)
Rows matched: 1  Changed: 1  Warnings: 0

mysql> select * from employee_payroll;
+----+---------+--------+------------+------------+
| id | name    | gender | salary     | start      |
+----+---------+--------+------------+------------+
|  1 | Bill    | M      | 1000000.88 | 2018-01-03 |
|  2 | Terisa  | M      | 2000000.88 | 2019-05-13 |
|  3 | Charlie | M      | 6000000.88 | 2020-11-21 |
+----+---------+--------+------------+------------+
3 rows in set (0.00 sec)

mysql> SELECT SUM(salary) FROM employee_payroll
    -> ;
+-------------+
| SUM(salary) |
+-------------+
|  9000002.64 |
+-------------+
1 row in set (0.01 sec)

mysql> SELECT SUM(salary) FROM employee_payroll
    -> WHERE gender = 'M' GROUP BY gender;
+-------------+
| SUM(salary) |
+-------------+
|  9000002.64 |
+-------------+
1 row in set (0.00 sec)

mysql> select avg(salary) from employee_payroll
    -> where gender = 'M' group by gender;
+--------------------+
| avg(salary)        |
+--------------------+
| 3000000.8800000004 |
+--------------------+
1 row in set (0.00 sec)

mysql> select max(salary) from employee_payroll
    -> where gender = 'm' group by gender;
+-------------+
| max(salary) |
+-------------+
|  6000000.88 |
+-------------+
1 row in set (0.00 sec)

mysql> select count(salary) from employee_payroll
    -> where gender = 'm' group by gender;
+---------------+
| count(salary) |
+---------------+
|             3 |
+---------------+
1 row in set (0.00 sec)

mysql> select gender, count(salary) from employee_payroll group by gender;
+--------+---------------+
| gender | count(salary) |
+--------+---------------+
| M      |             3 |
+--------+---------------+
1 row in set (0.00 sec)

mysql> select name, gender, min(salary) from employee_payroll;
+------+--------+-------------+
| name | gender | min(salary) |
+------+--------+-------------+
| Bill | M      |  1000000.88 |
+------+--------+-------------+
1 row in set (0.00 sec)

mysql>